{
  "schema_version": "0.1.0",
  "post_id": 9313,
  "content_type": "cornerstone",
  "responds_to": {
    "review_file": "reviews/posts/9313/01-review.json",
    "timestamp": "2026-09-25T05:37:12Z"
  },
  "repo": {
    "commit": "05df796ac4547d943aebfc64e7bd30819b5c70f4",
    "state": "dirty"
  },
  "wordpress": {
    "post_id": 9313,
    "revision_id": null,
    "modified_gmt": null,
    "status": "draft",
    "permalink": "https://dev.alleastbayproperties.com/?p=9313"
  },
  "reviewer": {
    "name": "claude",
    "identity": "Claude (Cowork)"
  },
  "timestamp": "2026-09-25T05:50:00Z",
  "dispositions": [
    {
      "finding_id": "9313-F01",
      "disposition": "accepted",
      "rationale": "Correct: the published AGA/RAP figures are standard annual adjustments, not a universal cap on every increase (banking, new-tenancy eligibility and other exceptions apply). Costa-Hawkins sentence also lacked an exceptions reminder.",
      "change_applied": "Body, Key Facts row and FAQ 5 now describe 2.3%/1.0% as the current standard annual adjustments subject to eligibility, banked increases and other exceptions; added 'with some statutory exceptions' to the Costa-Hawkins statements; Berkeley source now links directly to the Rent Board AGA page; Oakland source relabeled 'Allowable Rent Increases'. Existing rent-control comparison link kept.",
      "quote_before": "After that, annual increases on covered units are capped by the city: 2.3% in Oakland for August 2026 through July 2027, and 1.0% in Berkeley for 2026.",
      "quote_after": "After that, covered units follow each city's annual adjustment rules. The current standard adjustments are 2.3% in Oakland (August 2026 through July 2027) and 1.0% in Berkeley (2026), subject to eligibility rules, banked increases and other exceptions."
    },
    {
      "finding_id": "9313-F02",
      "disposition": "accepted",
      "rationale": "Verified against peterlohmann.com/blog/pm-trends-report-2026: 5.1 weeks is 2025 median days on market in ShowMojo platform data (1.3M leased units); 3 weeks is an owner survey estimate. Different statistic, measure and period than the draft stated.",
      "change_applied": "Key Facts row relabeled 'National median days on market (ShowMojo platform data, 2025)', with the 3-week owner estimate explicitly marked as a different measure rather than a like-for-like comparison; the '70% longer' claim removed; source line and link updated to the PM Trends Report 2026 write-up.",
      "quote_before": "National average vacancy between tenants | 5.1 weeks, about 70% longer than the 3 weeks landlords typically estimate | ShowMojo platform data, Q1 2026",
      "quote_after": "National median days on market (ShowMojo platform data, 2025) | 5.1 weeks. Owners surveyed estimated about 3 weeks, but that's a different measure, not a like-for-like comparison. | PM Trends Report 2026"
    },
    {
      "finding_id": "9313-F03",
      "disposition": "accepted",
      "rationale": "The 25–30 day figure ends at signed lease; the example's 28 days is rent-free time. The annotation conflated two clocks.",
      "change_applied": "Removed the benchmark equivalence from the table; the hypothetical note now defines 'days vacant' as rent-free days from listing-ready to rent start, with identical make-ready and move-in timing assumed for both scenarios. 28/70 days, 42-day difference and ~$3,450 unchanged.",
      "quote_before": "About 28 (in line with AEBP's 25–30 day average)",
      "quote_after": "About 28 ... \"Days vacant\" here means rent-free days from the day the unit is ready to list until rent starts, with the same make-ready and move-in timing assumed in both cases."
    },
    {
      "finding_id": "9313-F04",
      "disposition": "accepted",
      "rationale": "Agreed the condition claim isn't documented; the held case note records make-ready work. Removed it rather than seeking confirmation. On reuse: Brian instructed in the 2026-09-24 Cowork session to use the pricing story but keep it vague enough that the owner would not feel humiliated; the published wording carries none of the case's distinctive figures, dates, city or unit type. Final sign-off on the exact wording and the anecdote-log entry remain Brian's. UPDATE 2026-09-25: Brian approved the final anonymized wording in-session; logged in knowledge/company/anecdote-log.md (2026-09-25 entry) with reuse limits.",
      "change_applied": "Deleted 'Nothing was wrong with the unit' from the article and from both script copies (9313 and 9315). Script line now reads 'The asking price was simply above what renters were paying.' Anecdote-log entry deferred until Brian approves the final wording. Anecdote-log entry added after Brian's approval.",
      "quote_before": "Nothing was wrong with the unit, and nothing was unreasonable about wanting top dollar for it.",
      "quote_after": "Nothing was unreasonable about wanting top dollar for it."
    },
    {
      "finding_id": "9313-F05",
      "disposition": "accepted",
      "rationale": "CORNERSTONE-STRUCTURE requires an on-topic 'Before You [Act]' checklist.",
      "change_applied": "Added a 'Before You List' section before the FAQ with five items: compare listings and recent signed leases; check rent control/AB 1482 coverage and starting-rent rules; confirm market-ready condition, photos and showing access; calculate weekly vacancy cost; set a 7–14 day price-review date with predefined triggers.",
      "quote_before": null,
      "quote_after": "Before You List — Run through this before your listing goes live:"
    },
    {
      "finding_id": "9313-F06",
      "disposition": "requires_human",
      "rationale": "Source-level checks re-run (block markup edited only via targeted replacements; full resave done to refresh SEO/schema). Rendered-page, FAQ schema and mobile checks need an authenticated preview of the dev draft, which neither reviewer can reach anonymously.",
      "change_applied": null
    },
    {
      "finding_id": "9313-F07",
      "disposition": "accepted",
      "rationale": "Companion findings 9315-F01–F03 addressed in the separate 9315 response; script copies re-synchronized.",
      "change_applied": "Applied the 9315-F01/F02 script edits identically to the embedded script in 9313 (new opening line, six-extra-week framing, condition claim removed, 'In our view' label). Label remains 'Video Script' until the recording is checked.",
      "quote_before": "Here's a pricing mistake that costs East Bay landlords more than almost any repair: listing high to see what happens.",
      "quote_after": "Here's how testing a high rental price can cost thousands in lost rent."
    },
    {
      "finding_id": "SCORE-READABILITY",
      "disposition": "accepted",
      "rationale": "Editorial polish items from the review notes: categorical diagnoses, asking vs achieved rent, seasonal wording.",
      "change_applied": "Showing-data table now hedged ('may be ruling it out'; 'if the photos, showing access and listing details all check out, price is the most likely cause'; 'often price relative to condition'). Fee paragraph says 'higher achieved rent'. Key Facts, body and FAQ 4 now distinguish summer-concentrated move-ins from the recent earlier (March) national rent-growth peak."
    }
  ],
  "operating_system_followups": [
    {
      "description": "Created knowledge/company/industry-vacancy-benchmarks.md recording the ShowMojo 5.1-week figure as 2025 median days on market (not average between-tenant vacancy, not Q1 2026). Older content repeating the conflation still needs a separate audit: fees page 7776 ('Vacancy cost' paragraph) and Thursday Tip 7928.",
      "target_doc": "knowledge/company/industry-vacancy-benchmarks.md",
      "type_c_followup": true
    }
  ],
  "summary": "All seven findings answered; F01–F05 and F07 fixed in the draft, plus readability polish. F06 (rendered/preview checks) and anecdote wording approved by Brian and logged. Nothing published.",
  "requires_human_review": true,
  "recommendation_to_brian": "hold_for_brian_decision"
}