{
  "schema_version": "1.0.0",
  "post_id": 10195,
  "content_type": "cornerstone",
  "responds_to": {
    "review_file": "reviews/posts/10195/01-review.json",
    "timestamp": "2026-10-18T20:35:41-07:00"
  },
  "repo": {
    "commit": "0305b6c9da398319b776f00abc70543e065950d4",
    "state": "dirty"
  },
  "wordpress": {
    "post_id": 10195,
    "revision_id": null,
    "modified_gmt": null,
    "status": "draft",
    "permalink": "https://dev.alleastbayproperties.com/?p=10195"
  },
  "reviewer": {
    "name": "claude",
    "identity": "Claude (Cowork)"
  },
  "timestamp": "2026-10-19T04:20:00Z",
  "dispositions": [
    {
      "finding_id": "10195-F01",
      "disposition": "accepted_with_modification",
      "rationale": "Agreed: §1941.3(b) notice is limited to deficiencies covered by subsection (a). Reviewer's wording adopted in substance, in plainer second person for the Quick Answer; script wording adopted verbatim.",
      "change_applied": "Quick Answer final two sentences replaced; fourth paragraph of the Video Script replaced in 10195 and 10196 (and the HeyGen script in the package notes).",
      "quote_before": "Then respond to every security report quickly and keep a record. A report is notice under Civil Code §1941.3, and what you do after notice is what courts look at.",
      "quote_after": "Then acknowledge every security report quickly, assess it and keep a record. A report of a broken lock or other deficiency covered by Civil Code §1941.3 can put you on notice, and the statute allows a reasonable time to fix it. Other security reports can raise duties under other law, so assess and document each one."
    },
    {
      "finding_id": "10195-F02",
      "disposition": "accepted",
      "rationale": "Agreed: §1946.8(b)-(c) protect calls made by or on behalf of a person facing abuse, a crime or an emergency who believes help is necessary; the draft stated it unconditionally.",
      "change_applied": "Key Facts row heading and text, words-table 'Why' cell, FAQ 4 question and answer, and the third Video Script paragraph (both posts) rewritten to carry the statute's conditions.",
      "quote_before": "Tenants can always call the police | A lease term that limits a tenant's right to call law enforcement or emergency help is void.",
      "quote_after": "Protected calls for police or emergency help | Civil Code §1946.8 protects calls made by or on behalf of someone facing abuse, a crime or an emergency who believes help is needed. A lease can't restrict those calls, and a landlord can't penalize a tenant or resident for them (fees, eviction, non-renewal or worse terms). No documentation is required to show that belief."
    },
    {
      "finding_id": "10195-F03",
      "disposition": "accepted_with_modification",
      "rationale": "Agreed the sentence generalized the guard-specific heightened-foreseeability rule. Reviewer's replacement used, lightly reworded for flow; package-theft cell replaced as proposed.",
      "change_applied": "Complaint-section sentence replaced; 'When to Upgrade' package-theft cell replaced.",
      "quote_before": "Step 5 is the one owners skip. A single incident is rarely foreseeable.",
      "quote_after": "Step 5 is the one owners skip. Don't wait for a second incident before assessing a known hazard. The duty depends on how foreseeable the risk is and how burdensome the precaution would be, and hiring guards takes a higher level of foreseeability than simpler fixes."
    },
    {
      "finding_id": "10195-F04",
      "disposition": "accepted_with_modification",
      "rationale": "Agreed the 'leave out' list could read as advice to withhold known incidents, and the negative statutory claim was unsupported. Kept the C.A.R. neighborhood-conditions sentences that follow; replaced the list and the bulletin sentence.",
      "change_applied": "'What to leave out' sentences replaced; 'No statute requires a general crime bulletin. But' replaced.",
      "quote_before": "What to leave out: crime statistics you've pulled together yourself, a description of the neighborhood, and any claim about how often something happens at the building. Stick to what to do and who to call.",
      "quote_after": "What to leave out: unsupported safety ratings, crime statistics you've pulled together yourself, and promises about outcomes. That doesn't mean holding back known safety information. When you know about a specific incident or hazard, get legal advice about whether to warn or disclose."
    },
    {
      "finding_id": "10195-F05",
      "disposition": "accepted_with_modification",
      "rationale": "Agreed the manifest requires a 'Before You [Act]' checklist. Inserted after Bottom Line, before the FAQ, with the reviewer's five items lightly reworded (e.g. naming 'safe' and 'secure').",
      "change_applied": "New native group/list block 'Before You Talk With Tenants About Safety' (5 items) inserted before the FAQ group.",
      "quote_before": null,
      "quote_after": "Before You Talk With Tenants About Safety: Check that every security feature you mention exists and works; Replace \"safe\" and \"secure\" in listings, leases and scripts with factual descriptions; Give tenants current maintenance and police contact information in writing; Log every security report, assess its urgency and document the follow-up; Ask an attorney about known hazards, incident warnings and protected lock-change requests"
    },
    {
      "finding_id": "10195-F06",
      "disposition": "accepted_with_modification",
      "rationale": "Agreed the 'Prefer video?' invitation over-promises before the video exists. Removed the paragraph instead of adding a second 'in production' line, since the placeholder already says that; it will be restored with the real length at the video swap. Rendered-page, schema and preview checks stay open until the swap and publish, as on 10112-F04.",
      "change_applied": "'Prefer video?' paragraph removed from 10195. Restoration step added to the package notes.",
      "quote_before": "Prefer video? Watch the video version, with chapter timestamps and a full transcript.",
      "quote_after": null
    },
    {
      "finding_id": "10195-F07",
      "disposition": "accepted_with_modification",
      "rationale": "The press-5 instruction was read in the Alameda County DA's June 2026 non-emergency list on 2026-10-18, so it isn't unverified. But it adds little and the reviewer couldn't reach the source, so it was removed rather than defended.",
      "change_applied": "Parenthetical removed from the move-in packet table.",
      "quote_before": "Emeryville 510-596-3700 (Emeryville: press 5 for dispatch or a police report)",
      "quote_after": "Emeryville 510-596-3700"
    }
  ],
  "operating_system_followups": [
    {
      "description": "Optional GBP precision from the review notes applied: the GBP copy now says the court let a tenant sue a landlord who called a complex safe and patrolled while knowing about earlier assaults. Facebook, YouTube description and _aebp_cb_leadin drafts were also updated to drop 'can't discourage calls to the police' / 'every security report counts as notice'.",
      "target_doc": "10-October/week4/2026-10-26-week4-package-notes.md",
      "type_c_followup": false
    },
    {
      "description": "Agree with the review's proposed knowledge/laws/landlord-security-duties.md reference (lock notice vs. guard foreseeability vs. general care vs. §1946.8 vs. warnings). Not created in this round.",
      "target_doc": "knowledge/laws/landlord-security-duties.md",
      "type_c_followup": true
    }
  ],
  "summary": "All seven 10195 findings accepted (four with modifications). Legal wording narrowed for §1941.3 notice, §1946.8 protected calls, foreseeability and warnings; checklist added; 'Prefer video?' link removed until the video exists; Emeryville parenthetical removed. Both posts resaved. Rendered preview, schema and video checks stay open until the video swap.",
  "requires_human_review": false,
  "recommendation_to_brian": "proceed_to_gpt_final_review"
}