{
  "schema_version": "1.0.0",
  "post_id": 10196,
  "content_type": "video",
  "responds_to": {
    "review_file": "reviews/posts/10196/01-review.json",
    "timestamp": "2026-10-18T20:35:41-07:00"
  },
  "repo": {
    "commit": "0305b6c9da398319b776f00abc70543e065950d4",
    "state": "dirty"
  },
  "wordpress": {
    "post_id": 10196,
    "revision_id": null,
    "modified_gmt": null,
    "status": "draft",
    "permalink": "https://dev.alleastbayproperties.com/?post_type=video&p=10196"
  },
  "reviewer": {
    "name": "claude",
    "identity": "Claude (Cowork)"
  },
  "timestamp": "2026-10-19T04:20:00Z",
  "dispositions": [
    {
      "finding_id": "10196-F01",
      "disposition": "accepted",
      "rationale": "Same issue as 10195-F02.",
      "change_applied": "Third Video Script paragraph and the §1946.8 key takeaway rewritten; chapter list item changed to 'Protected calls for police or emergency help'.",
      "quote_before": "Third, never discourage a call to the police. Under California Civil Code section 1946.8, a lease can't limit a tenant's right to call for help, and a landlord can't penalize them for it.",
      "quote_after": "Third, don't discourage calls for help. California Civil Code section 1946.8 protects calls about abuse, crime or an emergency when the caller believes help is needed. A lease can't restrict those calls, and a landlord can't penalize a tenant or resident for them."
    },
    {
      "finding_id": "10196-F02",
      "disposition": "accepted",
      "rationale": "Same issue as 10195-F01.",
      "change_applied": "Fourth Video Script paragraph and the 'security report is notice' key takeaway rewritten; chapter list item changed to 'Handling security reports, and when a report counts as notice'.",
      "quote_before": "Fourth, treat every security report as notice. Reply the same day, fix it, write it down, and watch for patterns.",
      "quote_after": "Fourth, as a best practice, acknowledge security reports promptly, assess the urgency, arrange needed repairs and keep a record. A report about a required lock can give notice under California's lock statute; other reports may raise different duties."
    },
    {
      "finding_id": "10196-F03",
      "disposition": "requires_human",
      "rationale": "Can't be resolved before the video is recorded. At the swap: real embed, SRT-based chapter timestamps, 'Video Transcript' relabel only after checking against the audio, length in title/Yoast title, thumbnail, then authenticated preview and Rich Results check (Videos on 10196 only) once published. Page stays draft until then.",
      "change_applied": null,
      "quote_before": "🎥 Video in production. It will appear here once it's live.",
      "quote_after": null
    }
  ],
  "summary": "Both legal findings accepted and applied to the script, takeaways and chapter list (matching 10195). F03 stays open until the video exists.",
  "requires_human_review": true,
  "recommendation_to_brian": "proceed_to_gpt_final_review"
}